bench/compare/results/2026-10-21-c9bbf7c/run.json

{
  "date": "2026-10-21T13:34:50Z",
  "git_sha": "c9bbf7cc142e19566bb18fda68294f8f52a6ecdf",
  "rounds": 20, "iters": 20,
  "load_check_ignored": false,
  "fast_build": false,
  "load1_at_start": 1.13,
  "load1_at_end": 1.25,
  "valid": true,
  "invalid_reason": "",
  "uptime_before": " 12:38:15 up 39 min,  0 user,  load average: 1.13, 1.38, 1.29",
  "uptime_after": " 13:34:50 up  1:35,  0 user,  load average: 1.25, 1.42, 1.51"
}

bench/compare/results/2026-10-21-c9bbf7c/summary-speedup.md

## Summary

Load before: ` 12:38:15 up 39 min,  0 user,  load average: 1.13, 1.38, 1.29`  
Load after: ` 13:34:50 up  1:35,  0 user,  load average: 1.25, 1.42, 1.51`